{"schema_version":1,"candidate_id":"P22A_SPR_ABS_15s_60s","specification_hash":"6dca34026989fc26bf2e282c48e6a058074bc60ad5df2d476824d5ff16e6a28a","code_version":"0000000000000000000000000000000000000000","dataset_authorization_id":"NOT_AUTHORIZED","research_run_id":"NOT_RUN","actionable":false,"strategy_eligible":false,"trade_direction":null,"primary_raw_pip_effect":null,"normalized_diagnostic_effect":null,"confidence_intervals":{},"raw_p_values":{},"adjusted_p_values":{},"fdr_decisions":{},"temporal_replication_results":{},"pair_stability":{},"concentration_diagnostics":{},"session_diagnostics":{},"regime_diagnostics":{},"missingness":{},"limitations":["Template only; no Phase 22B data accessed."],"terminal_scientific_classification":null,"reviewer_verdicts":{"statistical_validator":"PENDING","qa_reviewer":"PENDING"},"reviewer_artifact_hashes":{"statistical_validator":null,"qa_reviewer":null},"provenance_hashes":{}}